asset_id,asset_name,network_zone,criticality,cve,cvss_bt_score,epss,cisa_kev,contextualized_risk_score,naive_cvss_only_score,description
WEB-01,Public-facing Web Portal,DMZ,3,CVE-2020-11984,9.8,0.90039,False,81.32,98.0,Apache HTTP server 2.4.32 to 2.4.44 mod_proxy_uwsgi info disclosure and possible RCE
RTU-01,Remote Terminal Unit (substation),OT,5,CVE-2019-14927,7.5,0.41847,False,72.1,75.0,An issue was discovered on Mitsubishi Electric ME-RTU devices through 2.02 and INEA ME-RTU devices through 3.0. An unauthenticated remote configuratio
WEB-01,Public-facing Web Portal,DMZ,3,CVE-2022-23943,9.8,0.50401,False,69.92,98.0,Out-of-bounds Write vulnerability in mod_sed of Apache HTTP Server allows an attacker to overwrite heap memory with possibly attacker provided data. T
SCADA-01,SCADA HMI Server,OT,5,CVE-2017-7689,9.0,0.05525,False,68.1,90.0,A Command Injection vulnerability in Schneider Electric homeLYnk Controller exists in all versions before 1.5.0.
RTU-01,Remote Terminal Unit (substation),OT,5,CVE-2019-14930,9.0,0.02343,False,67.06,90.0,An issue was discovered on Mitsubishi Electric ME-RTU devices through 2.02 and INEA ME-RTU devices through 3.0. Undocumented hard-coded user passwords
RTU-01,Remote Terminal Unit (substation),OT,5,CVE-2019-14929,9.0,0.01936,False,66.93,90.0,An issue was discovered on Mitsubishi Electric ME-RTU devices through 2.02 and INEA ME-RTU devices through 3.0. Stored cleartext passwords could allow
MAIL-01,Government Email Server,IT,3,CVE-2018-8581,7.4,0.27558,True,65.49,74.0,"An elevation of privilege vulnerability exists in Microsoft Exchange Server, aka ""Microsoft Exchange Server Elevation of Privilege Vulnerability."" Thi"
SCADA-01,SCADA HMI Server,OT,5,CVE-2014-9198,8.5,0.04193,False,65.06,85.0,"The FTP server on the Schneider Electric ETG3000 FactoryCast HMI Gateway with firmware through 1.60 IR 04 has hardcoded credentials, which makes it ea"
DB-01,Citizen Records Database,IT,5,CVE-2019-1068,8.8,0.44665,False,61.37,88.0,"A remote code execution vulnerability exists in Microsoft SQL Server when it incorrectly handles processing of internal functions, aka 'Microsoft SQL "
WEB-01,Public-facing Web Portal,DMZ,3,CVE-2021-31618,7.5,0.51208,False,59.57,75.0,Apache HTTP Server protocol handler for the HTTP/2 protocol checks received request headers against the size limitations as configured for the server 
RTU-01,Remote Terminal Unit (substation),OT,5,CVE-2018-18759,7.1,0.0875,False,59.26,71.0,Modbus Slave 7.0.0 in modbus tools has a Buffer Overflow.
DB-01,Citizen Records Database,IT,5,CVE-2018-8273,9.0,0.29208,False,58.3,90.0,"A buffer overflow vulnerability exists in the Microsoft SQL Server that could allow remote code execution on an affected system, aka ""Microsoft SQL Se"
PLC-01,Siemens SIMATIC PLC (turbine control),OT,5,CVE-2016-3949,6.9,0.04492,False,56.84,69.0,Siemens SIMATIC S7-300 Profinet-enabled CPU devices with firmware before 3.2.12 and SIMATIC S7-300 Profinet-disabled CPU devices with firmware before 
VPN-GW-01,Remote Access VPN Gateway,DMZ,4,CVE-2017-3807,8.3,0.1476,False,56.22,83.0,"A vulnerability in Common Internet Filesystem (CIFS) code in the Clientless SSL VPN functionality of Cisco ASA Software, Major Releases 9.0-9.6, could"
PLC-01,Siemens SIMATIC PLC (turbine control),OT,5,CVE-2018-4850,6.9,0.02544,False,56.21,69.0,"A vulnerability has been identified in SIMATIC S7-400 (incl. F) CPU hardware version 4.0 and below (All versions), SIMATIC S7-400 (incl. F) CPU hardwa"
SCADA-01,SCADA HMI Server,OT,5,CVE-2019-13537,6.9,0.01297,False,55.8,69.0,The IEC870IP driver for AVEVA’s Vijeo Citect and Citect SCADA and Schneider Electric’s Power SCADA Operation has a buffer overflow vulnerability that 
RTU-01,Remote Terminal Unit (substation),OT,5,CVE-2021-22816,6.9,0.00947,False,55.69,69.0,A CWE-754: Improper Check for Unusual or Exceptional Conditions vulnerability exists that could cause a Denial of Service of the RTU when receiving a 
PLC-01,Siemens SIMATIC PLC (turbine control),OT,5,CVE-2018-16557,6.6,0.00821,False,54.09,66.0,"A vulnerability has been identified in SIMATIC S7-400 (incl. F) V6 and below (All versions), SIMATIC S7-400 PN/DP V7 (incl. F) (All versions), SIMATIC"
WEB-01,Public-facing Web Portal,DMZ,3,CVE-2018-18864,8.8,0.0257,False,51.57,88.0,Loadbalancer.org Enterprise VA MAX before 8.3.3 has XSS because Apache HTTP Server logs are displayed.
VPN-GW-01,Remote Access VPN Gateway,DMZ,4,CVE-2017-6608,7.9,0.04553,False,51.45,79.0,"A vulnerability in the Secure Sockets Layer (SSL) and Transport Layer Security (TLS) code of Cisco ASA Software could allow an unauthenticated, remote"
VPN-GW-01,Remote Access VPN Gateway,DMZ,4,CVE-2017-6607,8.0,0.02392,False,51.29,80.0,"A vulnerability in the DNS code of Cisco ASA Software could allow an unauthenticated, remote attacker to cause an affected device to reload or corrupt"
PLC-01,Siemens SIMATIC PLC (turbine control),OT,5,CVE-2016-2846,6.0,0.01691,False,51.25,60.0,"Siemens SIMATIC S7-1200 CPU devices before 4.0 allow remote attackers to bypass a ""user program block"" protection mechanism via unspecified vectors."
FW-01,Perimeter Firewall,DMZ,4,CVE-2019-17367,8.1,0.00562,False,51.22,81.0,"OpenWRT firmware version 18.06.4 is vulnerable to CSRF via wireless/radio0.network1, wireless/radio1.network1, firewall, firewall/zones, firewall/forw"
PLC-01,Siemens SIMATIC PLC (turbine control),OT,5,CVE-2018-4843,6.0,0.00547,False,50.88,60.0,"A vulnerability has been identified in SIMATIC CP 343-1 Advanced (All versions), SIMATIC CP 343-1 Standard (All versions), SIMATIC CP 443-1 Advanced ("
WIN-DC-01,Windows Domain Controller,IT,5,CVE-2016-0037,6.9,0.26256,False,49.16,69.0,The forms-based authentication implementation in Active Directory Federation Services (ADFS) 3.0 in Microsoft Windows Server 2012 R2 allows remote att
WIN-DC-01,Windows Domain Controller,IT,5,CVE-2018-16794,7.9,0.08026,False,48.61,79.0,Microsoft ADFS 4.0 Windows Server 2016 and previous (Active Directory Federation Services) has an SSRF vulnerability via the txtBoxEmail parameter in 
VPN-GW-01,Remote Access VPN Gateway,DMZ,4,CVE-2017-6610,7.1,0.02988,False,47.32,71.0,"A vulnerability in the Internet Key Exchange Version 1 (IKEv1) XAUTH code of Cisco ASA Software could allow an authenticated, remote attacker to cause"
VPN-GW-01,Remote Access VPN Gateway,DMZ,4,CVE-2017-6609,7.1,0.02842,False,47.28,71.0,"A vulnerability in the IPsec code of Cisco ASA Software could allow an authenticated, remote attacker to cause a reload of the affected system. The vu"
FW-01,Perimeter Firewall,DMZ,4,CVE-2019-0637,6.9,0.04297,False,46.78,69.0,"A security feature bypass vulnerability exists when Windows Defender Firewall incorrectly applies firewall profiles to cellular network connections, a"
LNX-APP-01,Internal Application Server,IT,2,CVE-2021-3449,5.9,0.62906,False,45.33,59.0,An OpenSSL TLS server may crash if sent a maliciously crafted renegotiation ClientHello message from a client. If a TLSv1.2 renegotiation ClientHello 
DB-01,Citizen Records Database,IT,5,CVE-2017-8516,6.9,0.08041,False,44.61,69.0,"Microsoft SQL Server Analysis Services in Microsoft SQL Server 2012, Microsoft SQL Server 2014, and Microsoft SQL Server 2016 allows an information di"
BACKUP-01,Backup & Recovery Server,IT,3,CVE-2018-11192,8.1,0.02709,False,42.08,81.0,Quest DR Series Disk Backup software version before 4.0.3.1 allows privilege escalation (issue 4 of 6).
BACKUP-01,Backup & Recovery Server,IT,3,CVE-2018-11190,8.1,0.02709,False,42.08,81.0,Quest DR Series Disk Backup software version before 4.0.3.1 allows privilege escalation (issue 2 of 6).
BACKUP-01,Backup & Recovery Server,IT,3,CVE-2021-40387,8.1,0.02427,False,42.01,81.0,An issue was discovered in the server software in Kaseya Unitrends Backup Software before 10.5.5-2. There is authenticated remote code execution.
BACKUP-01,Backup & Recovery Server,IT,3,CVE-2021-40385,8.1,0.01133,False,41.68,81.0,An issue was discovered in the server software in Kaseya Unitrends Backup Software before 10.5.5-2. There is a privilege escalation from read-only use
WIN-DC-01,Windows Domain Controller,IT,5,CVE-2016-3226,6.0,0.107,False,41.68,60.0,Active Directory in Microsoft Windows Server 2008 R2 SP1 and Server 2012 Gold and R2 allows remote authenticated users to cause a denial of service (s
DB-01,Citizen Records Database,IT,5,CVE-2019-0819,6.0,0.05373,False,40.34,60.0,"An information disclosure vulnerability exists in Microsoft SQL Server Analysis Services when it improperly enforces metadata permissions, aka 'Micros"
FW-01,Perimeter Firewall,DMZ,4,CVE-2017-3127,5.6,0.00961,False,39.84,56.0,A Cross-Site Scripting vulnerability in Fortinet FortiGate 5.2.0 through 5.2.10 allows attacker to execute unauthorized code or commands via the srcin
PRINT-01,Networked Printer/Scanner,IT,1,CVE-2019-6327,9.0,0.02374,False,39.59,90.0,"HP Color LaserJet Pro M280-M281 Multifunction Printer series (before v. 20190419), HP LaserJet Pro MFP M28-M31 Printer series (before v. 20190426) may"
SCADA-01,SCADA HMI Server,OT,5,CVE-2017-9637,3.8,0.00238,False,39.34,38.0,Schneider Electric Ampla MES 6.4 provides capability to interact with data from third party databases. When connectivity to those databases is configu
SCADA-01,SCADA HMI Server,OT,5,CVE-2017-9635,3.6,0.0024,False,38.3,36.0,Schneider Electric Ampla MES 6.4 provides capability to configure users and their privileges. When Ampla MES users are configured to use Simple Securi
FW-01,Perimeter Firewall,DMZ,4,CVE-2021-3499,5.1,0.00799,False,37.49,51.0,A vulnerability was found in OVN Kubernetes in versions up to and including 0.3.0 where the Egress Firewall does not reliably apply firewall rules whe
BACKUP-01,Backup & Recovery Server,IT,3,CVE-2015-5446,6.9,0.02514,False,37.23,69.0,HP StoreOnce Backup system software before 3.13.1 allows remote attackers to execute arbitrary code via unspecified vectors.
LNX-APP-01,Internal Application Server,IT,2,CVE-2015-3643,7.4,0.0153,False,35.98,74.0,"usb-creator before 0.2.38.3ubuntu0.1 on Ubuntu 12.04 LTS, before 0.2.56.3ubuntu0.1 on Ubuntu 14.04 LTS, before 0.2.62ubuntu0.3 on Ubuntu 14.10, and be"
PRINT-01,Networked Printer/Scanner,IT,1,CVE-2019-6325,8.1,0.00983,False,35.65,81.0,"HP Color LaserJet Pro M280-M281 Multifunction Printer series (before v. 20190419), HP LaserJet Pro MFP M28-M31 Printer series (before v. 20190426) may"
LNX-APP-01,Internal Application Server,IT,2,CVE-2017-11144,6.9,0.06164,False,35.14,69.0,"In PHP before 5.6.31, 7.x before 7.0.21, and 7.1.x before 7.1.7, the openssl extension PEM sealing code did not check the return value of the OpenSSL "
WIN-DC-01,Windows Domain Controller,IT,5,CVE-2017-0043,4.9,0.02059,False,35.11,49.0,"Active Directory Federation Services in Microsoft Windows 10 1607, Windows Server 2008 SP2 and R2 SP1, Windows Server 2012 Gold and R2, and Windows Se"
MAIL-01,Government Email Server,IT,3,CVE-2018-0924,6.0,0.08344,False,35.09,60.0,"Microsoft Exchange Server 2010 Service Pack 3 Update Rollup 20, Microsoft Exchange Server 2013 Cumulative Update 18, Microsoft Exchange Server 2013 Cu"
MAIL-01,Government Email Server,IT,3,CVE-2018-0940,6.0,0.0757,False,34.89,60.0,"Microsoft Exchange Outlook Web Access (OWA) in Microsoft Exchange Server 2010 Service Pack 3 Update Rollup 20, Microsoft Exchange Server 2013 Cumulati"
LNX-APP-01,Internal Application Server,IT,2,CVE-2014-1426,6.9,0.01408,False,33.95,69.0,A vulnerability in maasserver.api.get_file_by_name of Ubuntu MAAS allows unauthenticated network clients to download any file. This issue affects: Ubu
FW-01,Perimeter Firewall,DMZ,4,CVE-2015-1453,4.3,0.00774,False,33.8,43.0,"The qm class in Fortinet FortiClient 5.2.3.091 for Android uses a hardcoded encryption key of FoRtInEt!AnDrOiD, which makes it easier for attackers to"
WEB-01,Public-facing Web Portal,DMZ,3,CVE-2018-20885,4.9,0.00767,False,33.11,49.0,cPanel before 74.0.0 allows Apache HTTP Server configuration injection because of DocumentRoot variable interpolation (SEC-416).
WIN-DC-01,Windows Domain Controller,IT,5,CVE-2015-2535,3.4,0.11526,False,31.48,34.0,Active Directory in Microsoft Windows Server 2008 SP2 and R2 SP1 and Server 2012 Gold and R2 allows remote authenticated users to cause a denial of se
PRINT-01,Networked Printer/Scanner,IT,1,CVE-2019-6326,6.6,0.01712,False,29.83,66.0,"HP Color LaserJet Pro M280-M281 Multifunction Printer series (before v. 20190419), HP LaserJet Pro MFP M28-M31 Printer series (before v. 20190426) may"
MAIL-01,Government Email Server,IT,3,CVE-2021-34453,4.3,0.02674,False,26.87,43.0,Microsoft Exchange Server Denial of Service Vulnerability
LNX-APP-01,Internal Application Server,IT,2,CVE-2014-1428,4.9,0.00948,False,25.84,49.0,A vulnerability in generate_filestorage_key of Ubuntu MAAS allows an attacker to brute-force filenames. This issue affects Ubuntu MAAS versions prior 
PRINT-01,Networked Printer/Scanner,IT,1,CVE-2019-6323,5.6,0.01266,False,25.72,56.0,"HP Color LaserJet Pro M280-M281 Multifunction Printer series (before v. 20190419), HP LaserJet Pro MFP M28-M31 Printer series (before v. 20190426) may"
MAIL-01,Government Email Server,IT,3,CVE-2020-17085,3.4,0.03365,False,23.44,34.0,Microsoft Exchange Server Denial of Service Vulnerability
DB-01,Citizen Records Database,IT,5,CVE-2020-1455,1.8,0.01228,False,22.51,18.0,"A denial of service vulnerability exists when Microsoft SQL Server Management Studio (SSMS) improperly handles files, aka 'Microsoft SQL Server Manage"
PRINT-01,Networked Printer/Scanner,IT,1,CVE-2019-6324,4.4,0.00701,False,20.78,44.0,"HP Color LaserJet Pro M280-M281 Multifunction Printer series (before v. 20190419), HP LaserJet Pro MFP M28-M31 Printer series (before v. 20190426) may"
